{
  "id": "rtd-o-000017",
  "slug": "indian-type-foundry",
  "name": { "preferred": "Indian Type Foundry", "alternates": ["ITF"] },
  "external_ids": { "wikidata_qid": "Q20726011" },
  "kind": "foundry",
  "countries": ["India"],
  "location": "Ahmedabad",
  "founded_year": "2009",
  "website": "https://www.indiantypefoundry.com/",
  "description": "Type foundry in Ahmedabad, co-founded by Satya Rajpurohit and founded in 2009, designing and distributing multilingual fonts.",
  "sources": [
    { "url": "https://www.indiantypefoundry.com/about", "title": "About - Indian Type Foundry", "type": "foundry or publisher page", "publisher": "Indian Type Foundry", "archive_url": "https://web.archive.org/web/20260526024926/https://www.indiantypefoundry.com/about" }
  ],
  "record_status": "active",
  "superseded_by": null,
  "created_at": "2026-10-19",
  "updated_at": "2026-10-19"
}
