{
  "id": "rtd-o-000007",
  "slug": "dalton-maag",
  "name": { "preferred": "Dalton Maag", "alternates": [] },
  "external_ids": { "wikidata_qid": "Q3012558" },
  "kind": "foundry",
  "countries": ["United Kingdom"],
  "location": "London",
  "founded_year": "1991",
  "website": "https://www.daltonmaag.com/",
  "description": "Typeface design studio in London, founded in 1991, making retail and custom fonts.",
  "sources": [
    { "url": "https://www.daltonmaag.com/", "title": "Dalton Maag | Typeface Design Studio", "type": "foundry or publisher page", "publisher": "Dalton Maag", "archive_url": "https://web.archive.org/web/20261012134608/https://www.daltonmaag.com/" }
  ],
  "record_status": "active",
  "superseded_by": null,
  "created_at": "2026-10-19",
  "updated_at": "2026-10-19"
}
